{
 "version": 1,
 "factsHash": "d7514b4f4a1dfe1c",
 "author": "демо",
 "lead": [
  "Дольше всего Платформа ждала команду БД и разработчиков системы продаж: в августе–сентябре две подзадачи приёма заказов стояли 23 и 21 рабочий день из-за справочника и служебной учётки.",
  "Сейчас открыты 2 случая: партнёр не дал одобренный возврат на стенде, а DevOps — настройки прода для новых ручек витрины. Оба держат запуск приёма заказов."
 ],
 "sections": {
  "sides": "Внешние стороны забрали больше задаче-дней, чем ревью и тест внутри команды.",
  "stages": "Узкое место внутри команды — ревью: заход в очередь на ревью доходил до 24 рабочих дней.",
  "cases": "Самые долгие ожидания пришлись на август–сентябрь, два случая на 14 октября ещё открыты."
 },
 "sides": [
  {"id": "dba", "name": "Команда БД", "what": "Заполнения справочников на тестовом стенде"},
  {"id": "sales", "name": "Команда системы продаж", "what": "Служебной учётки к системе продаж"},
  {"id": "partner", "name": "Партнёр", "what": "Данных для проверки возвратов на своём стенде"},
  {"id": "devops", "name": "DevOps", "what": "Настроек прода: адрес монолита, nginx, переменные"},
  {"id": "review", "name": "Ревью своей команды", "what": "Проверки готового кода", "internal": true},
  {"id": "qa", "name": "Тестирование своей команды", "what": "Взятия задачи в тест", "internal": true}
 ],
 "cases": [
  {"waits": ["w1"], "side": "dba", "what": "Не заполнен справочник мероприятий на тестовом стенде", "evidence": "strong",
   "basis": "«Ждём заполнения справочника мероприятий на тестовом стенде от команды БД», связь depends on DBA-310"},
  {"waits": ["w2"], "side": "sales", "what": "Не выдали служебную учётку, обошлись временным решением", "evidence": "strong",
   "basis": "«Нет служебной учётки к системе продаж, пока работаем на временном решении»", "workaround": true},
  {"waits": ["w3"], "side": "review", "what": "Ревью перевода кэша на Redis", "evidence": "weak",
   "basis": "Статус «Review» 24 рабочих дня, комментариев нет"},
  {"waits": ["w4"], "side": "partner", "what": "Одобренный возврат на тестовом стенде партнёра", "evidence": "strong",
   "basis": "«Нужен одобренный возврат на тестовом стенде партнёра», связь is blocked by PART-77"},
  {"waits": ["w5"], "side": "devops", "what": "Настройки прода для новых ручек витрины", "evidence": "strong",
   "basis": "«Ждём от DevOps: адрес монолита, nginx, переменные окружения», связь is blocked by OPS-2201"},
  {"waits": ["w6"], "side": "review", "what": "Ревью ручки профиля", "evidence": "weak",
   "basis": "Статус «Review», комментариев нет"},
  {"waits": ["w8"], "side": "qa", "what": "Взятие в тест задачи про географию", "evidence": "weak",
   "basis": "Статус «Ready for Test», комментариев нет"}
 ],
 "notBlockers": [
  {"waits": ["w7"], "why": "Никого не ждали — пауза по приоритету: «Откладываем: приоритет у приёма заказов»"}
 ]
}
